{"grid":{"cost_ratio":[0.3,0.4,0.5,0.6,0.7,0.8,0.9],"salvage_ratio":[0.0,0.2,0.4]},"policy_check":{"caveat":"Demand is realised sales (units shipped), which understates true demand when stock ran out; costs are assumed; there is no carry-over inventory or lead time. Uplift is measured in assumed-GBP and can be negative.","description":"Rolling replay on real weekly demand: each of the last 26 weeks, order Q = forecast + sigma * z(cf) (newsvendor) versus Q = forecast (mean order) and Q = last year's week (seasonal-naive order); realised profit uses actual units sold. Forecast = mean4 backtest forecast; sigma = std of its earlier one-step errors. Costs are the SIMULATED defaults (cost 0.60, salvage 0.20 of cost).","items":18,"per_item":[{"item":"family:Bags and purses","profit_mean_order":213085.46395593113,"profit_newsvendor":213125.7266514643,"profit_snaive_order":171043.74602217806},{"item":"family:Bath and personal care","profit_mean_order":17402.04179254779,"profit_newsvendor":17299.25273156302,"profit_snaive_order":12174.477503354014},{"item":"family:Candles and fragrance","profit_mean_order":94803.56109127031,"profit_newsvendor":94684.96574716091,"profit_snaive_order":57095.210401640754},{"item":"family:Garden and outdoor","profit_mean_order":28810.18236041628,"profit_newsvendor":28864.68750144471,"profit_snaive_order":32262.396227646066},{"item":"family:Home decor","profit_mean_order":310739.4451915902,"profit_newsvendor":309393.7754230008,"profit_snaive_order":302743.9940047133},{"item":"family:Jewellery and accessories","profit_mean_order":23453.84698040066,"profit_newsvendor":23485.990408444086,"profit_snaive_order":9478.17020100134},{"item":"sku:84077","profit_mean_order":794.0025999999998,"profit_newsvendor":904.3038194766131,"profit_snaive_order":-1222.0135999999998},{"item":"sku:85099B","profit_mean_order":11521.302000000001,"profit_newsvendor":11584.619136003397,"profit_snaive_order":9938.292000000001},{"item":"sku:21212","profit_mean_order":1604.5040000000001,"profit_newsvendor":1724.382294098873,"profit_snaive_order":-849.9919999999996},{"item":"sku:85123A","profit_mean_order":8111.379000000001,"profit_newsvendor":8715.900427227,"profit_snaive_order":-3352.3799999999974},{"item":"sku:22197","profit_mean_order":5298.321999999998,"profit_newsvendor":5272.125520836588,"profit_snaive_order":5896.892},{"item":"sku:84879","profit_mean_order":6221.633599999999,"profit_newsvendor":6224.053924460631,"profit_snaive_order":2487.2743999999975},{"item":"sku:17003","profit_mean_order":157.76,"profit_newsvendor":247.4030419809224,"profit_snaive_order":-3527.3976},{"item":"sku:21977","profit_mean_order":588.4670000000001,"profit_newsvendor":747.4772731378116,"profit_snaive_order":-39.68799999999986},{"item":"sku:84991","profit_mean_order":600.1380000000003,"profit_newsvendor":636.4475971601504,"profit_snaive_order":-671.2200000000001},{"item":"sku:15036","profit_mean_order":749.2908000000002,"profit_newsvendor":953.321309307182,"profit_snaive_order":-1370.4295999999995},{"item":"sku:22492","profit_mean_order":1197.5339999999999,"profit_newsvendor":1280.082408958289,"profit_snaive_order":1217.6840000000004},{"item":"sku:84755","profit_mean_order":1107.0540000000003,"profit_newsvendor":1144.3033904799108,"profit_snaive_order":329.5240000000001}],"profit_mean_order":726245.9283721561,"profit_newsvendor":726288.818606205,"uplift_pct":0.00590574519916143,"weeks_evaluated":26},"scenarios":[{"cost_ratio":0.3,"critical_fractile":0.7000000000000001,"item":"family:Bags and purses","mean_order_profit":19448.853291941377,"profit_empirical":11656.057601680774,"profit_normal":19788.351255613372,"q_empirical":14280.0,"q_normal":20674.550940882786,"salvage_ratio":0.0,"service_level":0.7},{"cost_ratio":0.3,"critical_fractile":0.7446808510638298,"item":"family:Bags and purses","mean_order_profit":19607.418334632748,"profit_empirical":11992.2044170411,"profit_normal":20090.767267282004,"q_empirical":14999.0,"q_normal":21196.225110033563,"salvage_ratio":0.2,"service_level":0.7446808510638299},{"cost_ratio":0.3,"critical_fractile":0.7954545454545455,"item":"family:Bags and purses","mean_order_profit":19765.98337732412,"profit_empirical":12386.565532211449,"profit_normal":20437.48860727922,"q_empirical":15847.0,"q_normal":21851.624529462897,"salvage_ratio":0.4,"service_level":0.7954545454545456},{"cost_ratio":0.4,"critical_fractile":0.6,"item":"family:Bags and purses","mean_order_profit":16292.90986287506,"profit_empirical":9286.491459372202,"profit_normal":16376.375546340747,"q_empirical":13807.0,"q_normal":19614.915635696823,"salvage_ratio":0.0,"service_level":0.5999999999999999},{"cost_ratio":0.4,"critical_fractile":0.6521739130434783,"item":"family:Bags and purses","mean_order_profit":16504.329919796888,"profit_empirical":9675.007812438074,"profit_normal":16683.42920222299,"q_empirical":13969.0,"q_normal":20153.812496339317,"salvage_ratio":0.2,"service_level":0.6521739130434782},{"cost_ratio":0.4,"critical_fractile":0.7142857142857143,"item":"family:Bags and purses","mean_order_profit":16715.749976718715,"profit_empirical":10081.878334815541,"profit_normal":17044.259451596852,"q_empirical":14387.0,"q_normal":20836.976698208196,"salvage_ratio":0.4,"service_level":0.7142857142857144},{"cost_ratio":0.5,"critical_fractile":0.5,"item":"family:Bags and purses","mean_order_profit":13136.966433808744,"profit_empirical":7048.1587355915035,"profit_normal":13136.966433808744,"q_empirical":12462.0,"q_normal":18624.5,"salvage_ratio":0.0,"service_level":0.5},{"cost_ratio":0.5,"critical_fractile":0.5555555555555556,"item":"family:Bags and purses","mean_order_profit":13401.241504961028,"profit_empirical":7441.357154999769,"profit_normal":13424.341295094757,"q_empirical":13401.0,"q_normal":19170.672672857847,"salvage_ratio":0.2,"service_level":0.5555555555555555},{"cost_ratio":0.5,"critical_fractile":0.625,"item":"family:Bags and purses","mean_order_profit":13665.516576113314,"profit_empirical":7898.849261027892,"profit_normal":13770.166299219653,"q_empirical":13940.0,"q_normal":19870.16416711561,"salvage_ratio":0.4,"service_level":0.6250000000000001},{"cost_ratio":0.6,"critical_fractile":0.4,"item":"family:Bags and purses","mean_order_profit":9981.023004742427,"profit_empirical":5046.210402454717,"profit_normal":10064.488688208112,"q_empirical":10467.0,"q_normal":17634.084364303177,"salvage_ratio":0.0,"service_level":0.4000000000000001},{"cost_ratio":0.6,"critical_fractile":0.4545454545454546,"item":"family:Bags and purses","mean_order_profit":10298.153090125168,"profit_empirical":5363.682394739474,"profit_normal":10313.26482695831,"q_empirical":12298.0,"q_normal":18178.112812371623,"salvage_ratio":0.2,"service_level":0.45454545454545464},{"cost_ratio":0.6,"critical_fractile":0.5263157894736843,"item":"family:Bags and purses","mean_order_profit":10615.28317550791,"profit_empirical":5788.619019429178,"profit_normal":10619.654470125583,"q_empirical":12798.0,"q_normal":18882.561490770917,"salvage_ratio":0.4,"service_level":0.5263157894736842},{"cost_ratio":0.7,"critical_fractile":0.3,"item":"family:Bags and purses","mean_order_profit":6825.079575676107,"profit_empirical":3397.1311088170532,"profit_normal":7164.577539348102,"q_empirical":9283.0,"q_normal":16574.449059117214,"salvage_ratio":0.0,"service_level":0.3000000000000001},{"cost_ratio":0.7,"critical_fractile":0.34883720930232553,"item":"family:Bags and purses","mean_order_profit":7195.064675289305,"profit_empirical":3591.125332556467,"profit_normal":7360.238022872306,"q_empirical":9774.0,"q_normal":17105.87791545439,"salvage_ratio":0.2,"service_level":0.34883720930232553},{"cost_ratio":0.7,"critical_fractile":0.4166666666666667,"item":"family:Bags and purses","mean_order_profit":7565.0497749025035,"profit_empirical":3850.11320662004,"profit_normal":7606.714507591586,"q_empirical":10723.0,"q_normal":17801.867456433843,"salvage_ratio":0.4,"service_level":0.41666666666666663},{"cost_ratio":0.8,"critical_fractile":0.19999999999999996,"item":"family:Bags and purses","mean_order_profit":3669.136146609788,"profit_empirical":1897.0189510202472,"profit_normal":4457.308888576361,"q_empirical":8146.0,"q_normal":15334.330825978464,"salvage_ratio":0.0,"service_level":0.2},{"cost_ratio":0.8,"critical_fractile":0.23809523809523803,"item":"family:Bags and purses","mean_order_profit":4091.976260453443,"profit_empirical":2056.1166602500443,"profit_normal":4589.554513555285,"q_empirical":8794.0,"q_normal":15839.33012796249,"salvage_ratio":0.2,"service_level":0.23809523809523792},{"cost_ratio":0.8,"critical_fractile":0.2941176470588235,"item":"family:Bags and purses","mean_order_profit":4514.816374297098,"profit_empirical":2247.128543290293,"profit_normal":4759.795148940677,"q_empirical":9283.0,"q_normal":16508.011787723724,"salvage_ratio":0.4,"service_level":0.2941176470588234},{"cost_ratio":0.9,"critical_fractile":0.10000000000000003,"item":"family:Bags and purses","mean_order_profit":513.1927175434757,"profit_empirical":680.9330337600168,"profit_normal":1993.3733923207583,"q_empirical":6365.0,"q_normal":13614.501098268887,"salvage_ratio":0.0,"service_level":0.09999999999999998},{"cost_ratio":0.9,"critical_fractile":0.12195121951219517,"item":"family:Bags and purses","mean_order_profit":988.8878456175878,"profit_empirical":756.42874658993,"profit_normal":2056.920737458825,"q_empirical":6795.0,"q_normal":14069.012959492262,"salvage_ratio":0.2,"service_level":0.12195121951219529},{"cost_ratio":0.9,"critical_fractile":0.15625000000000006,"item":"family:Bags and purses","mean_order_profit":1464.5829736916999,"profit_empirical":846.046259740968,"profit_normal":2140.329650901297,"q_empirical":7464.0,"q_normal":14676.122287590639,"salvage_ratio":0.4,"service_level":0.15625000000000006},{"cost_ratio":0.3,"critical_fractile":0.7000000000000001,"item":"family:Bath and personal care","mean_order_profit":1802.8364730493681,"profit_empirical":1303.894121132751,"profit_normal":1847.547973821606,"q_empirical":1362.0,"q_no